{
  "id": "moonlight-qt",
  "name": "Moonlight PC",
  "tagline": "GameStream client for PCs (Windows, Mac, Linux, and Steam Link)",
  "description": "Open source client for Sunshine and NVIDIA GameStream.",
  "category": "client",
  "platforms": ["windows", "macos", "linux"],
  "icon": "https://github.com/moonlight-stream.png",
  "links": {
    "website": "https://moonlight-stream.org/",
    "github": "https://github.com/moonlight-stream/moonlight-qt",
    "download": "https://github.com/moonlight-stream/moonlight-qt/releases/latest",
    "documentation": "https://github.com/moonlight-stream/moonlight-docs/wiki"
  },
  "official": true,
  "tags": ["streaming", "gamestream", "client", "gaming"],
  "compatibility": {
    "sunshine": ">=0.1.0"
  },
  "icons": [
    {
      "src": "https://cdn.jsdelivr.net/npm/simple-icons@16/icons/linux.svg",
      "alt": "Linux",
      "invert": true
    },
    {
      "src": "https://cdn.jsdelivr.net/npm/simple-icons@16/icons/macos.svg",
      "alt": "macOS",
      "invert": true
    },
    {
      "src": "https://cdn.jsdelivr.net/npm/bootstrap-icons@1.13.2/icons/windows.svg",
      "alt": "Windows",
      "invert": true
    },
    {
      "src": "https://cdn.jsdelivr.net/npm/simple-icons@16/icons/steam.svg",
      "alt": "Steam",
      "invert": true
    }
  ],
  "downloads": [
    {
      "label": "Download on GitHub",
      "url": "https://github.com/moonlight-stream/moonlight-qt/releases"
    }
  ]
}
